{"authorityGeneration":1,"expectedRoles":["app","agent"],"expectedTarget":"exact-dev:test","nowUnixMs":5000,"policyDigest":"sha256-_zQQTGu49DV9U2-uN8oL7of39wUj0lVLlmSgdQU_jSs","resolverGeneration":7,"resolverInventoryDigest":"sha256-YQrpYpveJqBxf9VqAteAkLJI4hrQqanUeaivqH1JYGU","schema":"ibex/composition-verifier-expectations/1","sessionNonce":"composition-fixture-session"}
